{
  "id": "skolni_tabor_palava_zakladni_ukoly",
  "system_id": "skolni_tabor_palava",
  "name": "Základní sada úkolů",
  "description": "Základní sada úkolů pro informační systém Školní Tábor Pálav",
  "levelCount": 6,
  "tasks": [
    {
      "id": "4881a760-cb8d-41cb-8784-fed13faa6a76",
      "title": "Délka turnusu",
      "description": "Určete, kolik dní trvá srpnový turnus. Funguje komponenta pro počet dní turnusu správně? Pokud ne, bude ji potřeba opravit.",
      "componentsRepaired": false,
      "completed": false,
      "activity": {
        "isCompleted": false,
        "substituteAfterActivity": false,
        "description": "Opravte komponentu, zodpovědnou za zobrazování počtu dnů turnusu, tak, aby správně zobrazovala počet dnů, které turnus trvá. Počet dnů turnusu by měl správně zahrnovat první i poslední den turnusu.",
        "activityComponents": [
          {
            "id": "pocet-dni-turnusu",
            "name": "Počet dní turnusu",
            "description": "Zobrazuje počet dní turnusu. Vyžaduje generalVariable: idTurnusu.",
            "html": "\n<div class=\"pocet-dni-turnusu-stitek\">\n  🗓️ Počet dní: {{ pocet_dni_turnusu }}\n</div>\n",
            "css": "\n.pocet-dni-turnusu-stitek {\n  display: inline-flex;\n  align-items: center;\n  gap: 6px;\n  padding: 6px 16px;\n  background: #16a34a;\n  border-radius: 8px;\n  font-size: 13px;\n  font-weight: 700;\n  color: #ffffff;\n}\n",
            "js": "",
            "js_click": "",
            "sql": {
              "pocet-dni-turnusu": "SELECT CAST(julianday(datum_do) - julianday(datum_od) AS INTEGER) AS pocet_dni_turnusu FROM turnusy WHERE id_turnusu = idTurnusu"
            },
            "sql_click": {},
            "tags": ["turnusy", "html", "css", "sql"],
            "edited": false,
            "variables": {
              "generalVariables": [
                {
                  "name": "idTurnusu",
                  "variable": 2
                }
              ],
              "sqlVariables": [
                {
                  "name": "pocet_dni_turnusu",
                  "variable": 9
                }
              ],
              "jsVariables": []
            }
          }
        ],
        "checkRepair": true,
        "repairChecks": [
          {
            "id": "57146129-e46f-4d1d-a01a-4efaaf2a963e",
            "componentId": "pocet-dni-turnusu",
            "componentName": "Počet dní turnusu",
            "operator": "contains",
            "text": "🗓️ Počet dní: 13"
          }
        ]
      },
      "activityType": "repair",
      "finish": {
        "isComplete": false,
        "description": "",
        "correctAnswer": "7",
        "label": "Kolik dnů trvá turnus č. 3?"
      },
      "finishType": "type-correct",
      "level": 3,
      "status": "not_started",
      "feedback": "Správně jste opravili komponentu. Problém byl, že výraz julianday(datum_do) - julianday(datum_od) vrací počet dnů mezi daty bez započtení koncového dne.",
      "pointsReward": 3,
      "failPenalty": 0.5,
      "answer": "",
      "errorComponents": [
        {
          "id": "pocet-dni-turnusu",
          "name": "Počet dní turnusu",
          "description": "Zobrazuje počet dní turnusu. Vyžaduje generalVariable: idTurnusu.",
          "html": "\n<div class=\"pocet-dni-turnusu-stitek\">\n  🗓️ Počet dní: {{ pocet_dni_turnusu }}\n</div>\n",
          "css": "\n.pocet-dni-turnusu-stitek {\n  display: inline-flex;\n  align-items: center;\n  gap: 6px;\n  padding: 6px 16px;\n  background: #16a34a;\n  border-radius: 8px;\n  font-size: 13px;\n  font-weight: 700;\n  color: #ffffff;\n}\n",
          "js": "",
          "js_click": "",
          "sql": {
            "pocet-dni-turnusu": "SELECT CAST(julianday(datum_do) - julianday(datum_od) AS INTEGER) AS pocet_dni_turnusu FROM turnusy WHERE id_turnusu = idTurnusu"
          },
          "sql_click": {},
          "tags": ["turnusy", "html", "css", "sql"],
          "edited": false,
          "variables": {
            "generalVariables": [
              {
                "name": "idTurnusu",
                "variable": 2
              }
            ],
            "sqlVariables": [
              {
                "name": "pocet_dni_turnusu",
                "variable": 9
              }
            ],
            "jsVariables": []
          }
        }
      ],
      "isEditable": false,
      "isSubstituted": false,
      "canExecuteQuery": false,
      "visiblePages": [
        {
          "name": "Nástěnka",
          "route": "/nastenka",
          "description": "Hlavní přehled o táboře, zobrazující důležité informace a statistiky."
        },
        {
          "name": "Turnusy",
          "route": "/turnusy",
          "description": "Přehled dostupných turnusů pro účastníky."
        },
        {
          "name": "Účastníci",
          "route": "/ucastnici",
          "description": "Seznam všech účastníků tábora s možností správy jejich údajů."
        }
      ],
      "codeEditPermissions": {
        "html": true,
        "css": true,
        "js": true,
        "sql": true,
        "js_click": false,
        "sql_click": true
      },
      "databaseAllowed": true
    },
    {
      "id": "384fbf48-d405-4599-9d5f-ecd8338e78c2",
      "title": "Naplnění turnusu",
      "description": "Zjistěte stav zaplnění turnusu č. 1. Turnus je skoro plný (tj. štítek SKORO PLNO), pokud má zaplnění větší nebo rovno 80% kapacity. Funguje komponenta pro stav turnusu správně? Pokud ne, bude ji potřeba opravit.",
      "componentsRepaired": false,
      "completed": false,
      "activity": {
        "isCompleted": false,
        "substituteAfterActivity": false,
        "activityComponents": [
          {
            "id": "stitek-stavu-turnusu",
            "name": "Štítek stavu turnusu",
            "description": "Štítek s dynamickými barvami řešenými přes inline styly pro zamezení úniku CSS.",
            "html": "\n<div class=\"obal-stavu-turnusu\">\n  <span class=\"stitek-stavu-turnusu\" \n        style=\"color: {{ s_barva_textu }}; background-color: {{ s_barva_pozadi }}; border-color: {{ s_barva_textu }};\">\n    {{ text_stavu }}\n  </span>\n</div>\n",
            "css": "\n.obal-stavu-turnusu {\n  display: inline-flex;\n  align-items: center;\n}\n\n.stitek-stavu-turnusu {\n  display: inline-flex;\n  padding: 4px 14px;\n  border-radius: 9999px;\n  font-size: 11px;\n  font-weight: 700;\n  text-transform: uppercase;\n  border: 1px solid;\n}\n",
            "js": "\nlet text_stavu = \"VOLNO\";\nlet s_barva_textu = \"#16a34a\";\nlet s_barva_pozadi = \"#dcfce7\";\n\nif (aktualni_pocet >= celkova_kapacita) {\n    text_stavu = \"PLNO\";\n    s_barva_textu = \"#dc2626\";\n    s_barva_pozadi = \"#fee2e2\";\n} else if (aktualni_pocet >= (celkova_kapacita * 0.8)) {\n    text_stavu = \"SKORO PLNO\";\n    s_barva_textu = \"#854d0e\";\n    s_barva_pozadi = \"#fef9c3\";\n}\n",
            "js_click": "",
            "sql": {
              "ziskat-kapacitu": "SELECT kapacita AS celkova_kapacita FROM turnusy WHERE id_turnusu = idTurnusu",
              "ziskat-obsazenost": "SELECT COUNT(*) AS aktualni_pocet FROM turnusy_ucastnici WHERE id_turnusu = idTurnusu"
            },
            "sql_click": {},
            "tags": ["turnusy", "html", "css", "js", "sql"],
            "edited": false,
            "variables": {
              "generalVariables": [
                {
                  "name": "idTurnusu",
                  "variable": 2
                }
              ],
              "sqlVariables": [],
              "jsVariables": []
            }
          }
        ],
        "label": "Opravte komponentu, která chybu způsobuje",
        "checkRepair": true,
        "repairChecks": [
          {
            "id": "5bf88f49-762d-4a97-86fd-5fc95cca5038",
            "componentId": "stitek-stavu-turnusu",
            "componentName": "Štítek stavu turnusu",
            "operator": "contains",
            "text": "VOLNO"
          }
        ]
      },
      "activityType": "repair",
      "finish": {
        "isComplete": false,
        "description": "Určete zaplnění turnusu č. 1.",
        "options": [
          {
            "id": "d5e72199-4360-4a1c-aee4-f6ec9da19cf2",
            "text": "PLNO",
            "isCorrect": false
          },
          {
            "id": "f7734ba2-5a21-4f6f-a762-f1f6d4f91cfa",
            "text": "SKORO PLNO",
            "isCorrect": false
          },
          {
            "id": "80f8fc30-3f6f-43a1-bf90-b7666105c58d",
            "text": "VOLNO",
            "isCorrect": true
          }
        ]
      },
      "finishType": "select-options",
      "level": 3,
      "status": "not_started",
      "feedback": "Správně jste opravili komponentu - chyba spočívala v tom, že byla chybně uvedena podmínka pro vytvoření štítku. Turnus byl skoro plný již od 30% zaplnění.",
      "pointsReward": 3,
      "failPenalty": 0.5,
      "answer": "",
      "errorComponents": [
        {
          "id": "stitek-stavu-turnusu",
          "name": "Štítek stavu turnusu",
          "description": "Štítek s dynamickými barvami řešenými přes inline styly pro zamezení úniku CSS.",
          "html": "\n<div class=\"obal-stavu-turnusu\">\n  <span class=\"stitek-stavu-turnusu\" \n        style=\"color: {{ s_barva_textu }}; background-color: {{ s_barva_pozadi }}; border-color: {{ s_barva_textu }};\">\n    {{ text_stavu }}\n  </span>\n</div>\n",
          "css": "\n.obal-stavu-turnusu {\n  display: inline-flex;\n  align-items: center;\n}\n\n.stitek-stavu-turnusu {\n  display: inline-flex;\n  padding: 4px 14px;\n  border-radius: 9999px;\n  font-size: 11px;\n  font-weight: 700;\n  text-transform: uppercase;\n  border: 1px solid;\n}\n",